https://www.rbc.ru/rbcfreenews/61c576f39a794744778df4fe,Появилось видео с места пожара в коронавирусной больнице в Астрахани,"24 дек, 10:54"
https://www.rbc.ru/society/24/12/2021/61c563d39a79473b315d622a,Обвиненному в педофилии оренбургскому священнику дали 21 год колонии,"24 дек, 10:30"
https://www.rbc.ru/society/24/12/2021/61c566a59a79473d4ac4e9d2,Московский стандарт: как изменилась онкологическая помощь в столице,"24 дек, 10:28"
https://www.rbc.ru/society/24/12/2021/61c56d949a79473f8675f053,«Первый канал» определился с названием программы «Поле чудес»,"24 дек, 10:03"
https://www.rbc.ru/rbcfreenews/61c535569a79472f5761f68c,"Эксперты выяснили, как много россиян любят оливье из курицы или колбасы","24 дек, 10:00"
https://www.rbc.ru/society/24/12/2021/61c56b0b9a79473f29587685,Двое погибли при пожаре в коронавирусной больнице в Астрахани,"24 дек, 09:42"
https://www.rbc.ru/rbcfreenews/61c55bf19a7947393503e420,Москвичей предупредили о порывистом ветре и аномальных морозах в выходные,"24 дек, 09:12"
https://www.rbc.ru/rbcfreenews/61c555259a794737ac4b560f,В Алтайском крае возбудили уголовное дело из-за нехватки угля для жителей,"24 дек, 08:47"
https://www.rbc.ru/society/24/12/2021/61c54b259a79473664e25c91,Подручного Шакро Молодого признали виновным в похищении бизнесмена из США,"24 дек, 08:38"
https://www.rbc.ru/rbcfreenews/61c546c39a794733fe2ae115,Адвокаты руководства «СДС-Уголь» обжаловали аресты по делу о «Листвяжной»,"24 дек, 07:37"
https://www.rbc.ru/rbcfreenews/61c53e3d9a794731ee70d4a5,Власти Москвы не будут вводить ограничения по COVID-19 до Нового года,"24 дек, 06:30"
https://www.rbc.ru/society/24/12/2021/61c53a249a7947317f1abdac,"Гинцбург заявил, что препарат на основе антител эффективен при «омикроне»","24 дек, 06:23"
https://www.rbc.ru/rbcfreenews/61c517459a794728c31ad2cb,Аналитики назвали самые популярные лекарства года,"24 дек, 05:32"
https://www.rbc.ru/rbcfreenews/61c51e849a794729d3d6c57c,Эквадор ввел обязательную вакцинацию от коронавируса,"24 дек, 05:13"
https://www.rbc.ru/society/24/12/2021/61c512369a79472799e4a0ae,В «Росатоме» предложили собирать батарейки в почтовых отделениях,"24 дек, 05:11"
https://www.rbc.ru/society/24/12/2021/61c4c7849a794719ec0a72f0,"Эксперты назвали профессии, где больше и меньше всего привитых от COVID","24 дек, 05:08"
https://www.rbc.ru/society/24/12/2021/61c519df9a79472c29dff38c,Правительство Южной Кореи решило помиловать экс-президента Пак Кын Хе,"24 дек, 03:53"
https://www.rbc.ru/society/24/12/2021/61c507019a7947255814eacd,Tesla отключит доступ к видеоиграм во время движения электрокара,"24 дек, 03:01"
https://www.rbc.ru/society/24/12/2021/61c4f5709a794724f83c30b7,Минсельхоз спрогнозировал рост цен на хлеб и подсолнечное масло в феврале,"24 дек, 02:07"
https://www.rbc.ru/society/24/12/2021/61c4e3899a79471dccc3a905,Генеральный продюсер ТНТ покинул канал,"24 дек, 00:55"
https://www.rbc.ru/society/24/12/2021/61c4a2819a79470caaa26094,Министр просвещения оценил вероятность удаленки в школах после каникул,"24 дек, 00:00"
