https://www.rbc.ru/society/27/12/2021/61ca1ec79a79474f3bdd9e05,Институт философии РАН после конфликта возглавит его научный руководитель,"27 дек, 23:58"
https://www.rbc.ru/society/27/12/2021/61c9b26a9a794725de488cc8,Правозащитники раскритиковали законопроект о наказании за пытки,"27 дек, 22:37"
https://www.rbc.ru/society/27/12/2021/61ca077b9a7947493afb8b6d,Флейтиста «Аквариума» Брайана Финнегана не впустили в Россию,"27 дек, 21:50"
https://www.rbc.ru/rbcfreenews/61c9f65e9a7947450e24d3d0,СК начал проверку после гибели Просвирнина в Москве,"27 дек, 21:34"
https://www.rbc.ru/society/27/12/2021/61c9ff5e9a794747744f73e3,Умер первый командир отряда «морских котиков» США Ричард Марсинко,"27 дек, 21:25"
https://www.rbc.ru/rbcfreenews/61c9f4099a7947446fb85adc,"Госагентства сообщили, что Просвирнин принял наркотики перед гибелью","27 дек, 21:11"
https://www.rbc.ru/rbcfreenews/61c9fadc9a7947466d752fa9,В работе Telegram произошел сбой,"27 дек, 20:54"
https://www.rbc.ru/rbcfreenews/61c9ee309a7947427414ce2c,В Свердловской области временно отменили QR-коды в кафе и фитнес-центрах,"27 дек, 20:32"
https://www.rbc.ru/rbcfreenews/61c9e53b9a79473fa8241fd7,Лавров обсудил с главой ВОЗ регистрацию «Спутника V»,"27 дек, 19:42"
https://www.rbc.ru/rbcfreenews/61c9c86b9a7947313d18b632,Разработчик «Авифавира» заявил о его эффективности против «омикрона»,"27 дек, 19:15"
https://www.rbc.ru/rbcfreenews/61c9cd169a794732b4b8f3c8,Путин пообещал увеличить возраст получателей лекарств через «Круг добра»,"27 дек, 18:56"
https://www.rbc.ru/rbcfreenews/61c9c4bc9a79472e26fab0a3,Экипаж упавшего в Удмуртии вертолета Ми-2 вышел на связь,"27 дек, 18:34"
https://www.rbc.ru/rbcfreenews/61c9d72f9a794739691de2ae,Путин помог решить квартирный вопрос семье мечтавшего о гитаре мальчика,"27 дек, 18:20"
https://www.rbc.ru/society/27/12/2021/61c9cca99a7947330d14d46c,Главный инфекционист США предупредил об опасности омикрон-штамма,"27 дек, 18:07"
https://www.rbc.ru/rbcfreenews/61c9bfc79a79472b9e5ea419,Бастрыкин взял на контроль дело об убийстве семьи в Канске,"27 дек, 18:01"
https://www.rbc.ru/society/27/12/2021/61c9d1c99a7947350e8910f3,Егор Просвирнин погиб после падения из окна в центре Москвы,"27 дек, 17:55"
https://www.rbc.ru/rbcfreenews/61c9ce929a79473499a1c718,Голый мужчина выпал из окна в центре Москвы,"27 дек, 17:54"
https://www.rbc.ru/rbcfreenews/61c9bc7f9a79472b2a1fd890,Путин назвал изучение русского языка лучшим способом адаптации мигрантов,"27 дек, 17:29"
https://www.rbc.ru/rbcfreenews/61c9b67b9a79472819dfafda,Синоптик пообещал жителям Москвы скандинавскую погоду в новогоднюю ночь,"27 дек, 16:50"
https://www.rbc.ru/rbcfreenews/61c9ae889a79472494893580,Не сдавших ПЦР-тест при въезде в Россию москвичей оштрафовали на ₽28 млн,"27 дек, 16:35"
https://www.rbc.ru/society/27/12/2021/61c9b58f9a7947283593376b,Обвиняемым в убийстве экс-спецназовца ГРУ назначили до 20 лет колонии,"27 дек, 16:27"
https://www.rbc.ru/rbcfreenews/61c9b54a9a7947279927a89a,СК начал проверку после падения вертолета Ми-2 в Удмуртии,"27 дек, 16:20"
https://www.rbc.ru/rbcfreenews/61c9b9269a794728b2a281d8,Ракета «Союз» со спутниками OneWeb стартовала с Байконура,"27 дек, 16:15"
https://www.rbc.ru/rbcfreenews/61c9b1669a794725838ee5b2,Общественные туалеты Петербурга станут бесплатными после Нового года,"27 дек, 16:07"
https://www.rbc.ru/society/27/12/2021/5e2fe9459a79479d102bada6,Вакцинация 100% россиян. Актуальное о пандемии на 27 декабря,"27 дек, 15:50"
https://www.rbc.ru/society/27/12/2021/61c9a7ad9a794720597ed8e9,В Удмуртии упал вертолет Ми-2,"27 дек, 14:51"
https://www.rbc.ru/rbcfreenews/61c9a3259a79471f17cbb533,Дептранс призвал отказаться от поездок по Киевскому шоссе,"27 дек, 14:35"
https://www.rbc.ru/society/27/12/2021/61c8608e9a794706e46047a7,В России в 10 раз сократили порог особо крупного размера для метадона,"27 дек, 14:03"
https://www.rbc.ru/rbcfreenews/61c97ad19a794708be5ba98b,В Амурске проверят инцидент с оказавшимся на морозе раздетым ребенком,"27 дек, 13:29"
https://www.rbc.ru/rbcfreenews/61c98d2e9a794711d95d3195,В Москве студентов эвакуировали из общежития МАДИ из-за пожара,"27 дек, 13:21"
https://www.rbc.ru/society/27/12/2021/61c98d0c9a794712963a9715,Чиновника Ростехнадзора арестовали по делу о лицензиях на ядерные отходы,"27 дек, 13:19"
https://www.rbc.ru/rbcfreenews/61c97f8d9a79470ac257385f,Военные ЗВО отразили условный массированный авиаудар в ходе учений,"27 дек, 13:15"
https://www.rbc.ru/rbcfreenews/61c972f79a794704d9760dba,В Белоруссии начали прививать подростков от коронавируса,"27 дек, 12:40"
https://www.rbc.ru/rbcfreenews/61c980fb9a79470cf80eb1ec,Матвиенко заявила о необходимости вакцинировать 100% россиян,"27 дек, 12:07"
https://www.rbc.ru/rbcfreenews/61c96efd9a794702b779bb94,В Барнауле осудили закрывавших детей в темноте воспитателей детского сада,"27 дек, 11:56"
https://www.rbc.ru/society/27/12/2021/61c97b5d9a7947093a406760,Число заражений COVID-19 в России вернулось на сентябрьский уровень,"27 дек, 11:44"
https://www.rbc.ru/rbcfreenews/61c9649a9a794784c979e43c,СК допустил убийство женщины и двоих детей в Канске ее мужем,"27 дек, 10:58"
https://www.rbc.ru/society/27/12/2021/61c965a59a7947842f0ba40b,Путин назначил медикам удвоенные выплаты по COVID в новогодние праздники,"27 дек, 10:49"
https://www.rbc.ru/rbcfreenews/61c95d619a794781206753bf,Власти Москвы закупят дополнительное оборудование для COVID-больниц,"27 дек, 10:47"
https://www.rbc.ru/rbcfreenews/61c957119a7947802a58050f,Ракова назвала единичными случаи фиктивной вакцинации в Москве,"27 дек, 10:29"
https://www.rbc.ru/society/27/12/2021/61c955f59a79477ee17aa494,Минтрансу предложили изменить алгоритм поворота направо на светофорах,"27 дек, 10:06"
https://www.rbc.ru/society/27/12/2021/61c95fe39a79478262f3e90a,Январские пенсии на карты москвичам перечислят в декабре,"27 дек, 09:55"
https://www.rbc.ru/rbcfreenews/61c9552b9a79477df24185ee,В мэрии не увидели «суперэффекта» для вакцинации от розыгрыша квартир,"27 дек, 09:38"
https://www.rbc.ru/rbcfreenews/61c95b069a7947811cc37713,Умер режиссер «Далласского клуба покупателей» и «Большой маленькой лжи»,"27 дек, 09:30"
https://www.rbc.ru/rbcfreenews/61c945bf9a79477481421daa,В Кремле заявили об отсутствии планов выносить тело Ленина из мавзолея,"27 дек, 08:24"
https://www.rbc.ru/rbcfreenews/61c937f99a79477109274ec1,В Красноярском крае нашли мертвой семью из четырех человек с двумя детьми,"27 дек, 07:26"
https://www.rbc.ru/rbcfreenews/61c930049a79476e0d99bfb6,Ракова сообщила об эффективности препарата от COVID-19 на основе антител,"27 дек, 06:41"
https://www.rbc.ru/rbcfreenews/61c926a49a794767f255927f,Хуснуллин призвал снизить допустимый уровень алкоголя в крови у водителей,"27 дек, 06:03"
https://www.rbc.ru/society/27/12/2021/61c91aa89a794761a939a141,Хуснуллин назвал рост цен на стройматериалы главной угрозой для отрасли,"27 дек, 05:36"
https://www.rbc.ru/rbcfreenews/61c72dc29a7947c7ab4d1740,Аналитики назвали города с самыми дорогими Дедами Морозами,"27 дек, 05:00"
https://www.rbc.ru/rbcfreenews/61c916f19a7947689cd08863,Строительство трассы Москва — Казань подорожало на 200 млрд руб.,"27 дек, 04:53"
https://www.rbc.ru/rbcfreenews/61c910d19a794746cf7ce60f,Цифровые паспорта начнут выдавать в трех регионах в 2023 году,"27 дек, 04:19"
https://www.rbc.ru/society/27/12/2021/61c908e39a79475d0a7e422b,Федор Бондарчук стал генеральным продюсером «НМГ студии»,"27 дек, 04:16"
https://www.rbc.ru/rbcfreenews/61c7e9909a7947ec0beb80ad,"Российские лыжники и сноубордисты рассказали, куда поедут кататься зимой","27 дек, 04:02"
https://www.rbc.ru/society/27/12/2021/61c8fcaa9a79475a759df58a,ИП с инвалидностью смогут получить статус социального предприятия,"27 дек, 03:22"
https://www.rbc.ru/rbcfreenews/61c9004c9a79475b52ada1b9,В России разрешили третью фазу испытаний корейского препарата от COVID-19,"27 дек, 03:17"
https://www.rbc.ru/society/27/12/2021/61c8eb289a794747394995e3,Ученые узнали о способности COVID-19 месяцами распространяться в органах,"27 дек, 02:15"
https://www.rbc.ru/rbcfreenews/61c8f3ef9a794754f5544474,ВОЗ анонсировала обсуждение глобального соглашения по борьбе с COVID-19,"27 дек, 02:13"
https://www.rbc.ru/rbcfreenews/61c8ed709a79475997e2428e,Путин поздравил сотрудников и ветеранов МЧС с Днем спасателя,"27 дек, 01:48"
https://www.rbc.ru/rbcfreenews/61c8b0829a79471a953cb6f8,Человек с гранатой попытался украсть товар в ТЦ «Метрополис»,"26 дек, 21:18"
https://www.rbc.ru/society/26/12/2021/61c894ce9a79471373e96c31,В «Шанинке» поддержали Институт философии РАН после смены директора,"26 дек, 20:18"
https://www.rbc.ru/rbcfreenews/61c886589a794710bcac025c,В Самаре приземлился самолет с неисправным шасси,"26 дек, 18:39"
https://www.rbc.ru/society/26/12/2021/61c8705a9a79470bc18d5aff,Родители оценили предложение члена СПЧ об учебе 9-летней студентки МГУ,"26 дек, 17:36"
https://www.rbc.ru/rbcfreenews/61c875599a79470c7be05063,Синоптик рассказал о погоде в Москве на Новый год,"26 дек, 17:27"
https://www.rbc.ru/rbcfreenews/61c85c499a7947065cdb792f,Песков фразой «ничего радужного не сулит» охарактеризовал 2022 год,"26 дек, 15:25"
https://www.rbc.ru/rbcfreenews/61c850459a7947030eece4f5,В Башкирии произошло второе за день массовое ДТП из-за снега,"26 дек, 15:08"
https://www.rbc.ru/society/26/12/2021/61c858e79a794704fc4ad62c,Следствие потребовало изменить меру пресечения блогеру Хованскому,"26 дек, 15:04"
https://www.rbc.ru/society/26/12/2021/61c84c779a79470204352048,В СПЧ назвали «опасным экспериментом» обучение 9-летней студентки в МГУ,"26 дек, 14:23"
https://www.rbc.ru/rbcfreenews/61c84aeb9a79470210c567b2,МЧС экстренно предупредило об опасной погоде в Москве,"26 дек, 14:17"
https://www.rbc.ru/rbcfreenews/61c82ae29a7947f8f5765874,Треть читателей NYT не смогли найти Украину на карте,"26 дек, 12:06"
https://www.rbc.ru/rbcfreenews/61c82bab9a7947fc6ea0052e,В России выявили минимум новых заболевших COVID-19 с конца сентября,"26 дек, 11:51"
https://www.rbc.ru/society/26/12/2021/61c81b939a7947f80dc74ba3,В ЮАР умер лауреат Нобелевской премии мира  архиепископ Десмонд Туту,"26 дек, 10:51"
https://www.rbc.ru/society/26/12/2021/61c81b239a7947f7d70fc5c9,МВД назвало сроки начала выдачи электронных паспортов россиянам,"26 дек, 10:44"
https://www.rbc.ru/society/26/12/2021/61c5b6d99a7947655ac7154d,«Холоп» и «Елки» на экспорт. Как в бывшем СССР смотрят фильмы из России,"26 дек, 10:00"
https://www.rbc.ru/society/26/12/2021/61c797179a7947e0d631ce97,«Талибан» запретил водителям включать музыку и возить женщин без хиджаба,"26 дек, 01:21"
https://www.rbc.ru/rbcfreenews/61c768ef9a7947d44216b9a8,В ХМАО продавцов обязали предъявлять покупателям QR-коды,"25 дек, 22:07"
https://www.rbc.ru/rbcfreenews/61c757489a7947d1b485e56e,На здании посольства США в Москве появилось поздравление «Дяде Сэму»,"25 дек, 21:32"
https://www.rbc.ru/rbcfreenews/61c754119a7947d0e8192843,Полиция задержала проникшего к замку с Елизаветой II,"25 дек, 21:29"
https://www.rbc.ru/society/25/12/2021/61c7586b9a7947d1f746c156,В Москве за взятку арестовали следователя и главу фирмы из Чайного дома,"25 дек, 21:20"
https://www.rbc.ru/rbcfreenews/61c74b8a9a7947cef3a6da9f,Беглов заявил о невозможности убрать снег из Петербурга за один «щелчок»,"25 дек, 20:28"
https://www.rbc.ru/society/25/12/2021/61c73f299a7947cc77cdffd4,Минздрав уточнил данные о случаях заражения «омикроном» в России,"25 дек, 19:56"
https://www.rbc.ru/rbcfreenews/61c72a499a7947c792304a2d,В Приморье баржа села на мель у острова Клыкова,"25 дек, 18:38"
https://www.rbc.ru/rbcfreenews/61c724799a7947c591fe32d8,Приглашенная Путиным в Москву школьница посетила ледовое шоу Навки,"25 дек, 17:36"
https://www.rbc.ru/rbcfreenews/61c71be39a7947c4d23f103f,Уголовное дело завели после гибели двоих в массовом ДТП под Волгоградом,"25 дек, 17:29"
https://www.rbc.ru/rbcfreenews/61c70b299a7947c0620f2255,Папа римский призвал не допустить метастазы конфликта на Украине,"25 дек, 16:43"
https://www.rbc.ru/photoreport/25/12/2021/61c6c4f99a7947aed682b108,Второе Рождество с COVID. Как католики и протестанты встретили праздник,"25 дек, 15:46"
https://www.rbc.ru/rbcfreenews/61c703d99a7947bf07c0bb64,В Ростовской области задержали двоих сбежавших из волгоградской колонии,"25 дек, 15:07"
https://www.rbc.ru/society/25/12/2021/61c6fb899a7947bc71da3f7f,В Томске подожгли второй гипермаркет «Лента» за неделю,"25 дек, 14:57"
https://www.rbc.ru/rbcfreenews/61c6f68a9a7947bbf3d17b83,В Москве после непогоды задержали десятки рейсов,"25 дек, 14:49"
https://www.rbc.ru/rbcfreenews/61c6e7009a7947b779f92fda,Мурашко рассказал о скорости распространения «омикрона»,"25 дек, 14:00"
https://www.rbc.ru/rbcfreenews/61c6d9499a7947b4f0fa0a56,Мурашко назвал ключ для «положительного исхода» после заболевания COVID,"25 дек, 13:28"
https://www.rbc.ru/society/25/12/2021/61c6dbbb9a7947b560c9f748,Умер писатель Альберт Лиханов,"25 дек, 13:12"
https://www.rbc.ru/society/25/12/2021/61c6e2d79a7947b6a21bc030,Главный онколог Минздрава назвал схожими цифры смертности от COVID и рака,"25 дек, 13:02"
https://www.rbc.ru/society/25/12/2021/61c6e4e59a7947b6dfd6034f,Мурашко рассказал о случаях «омикрона» в России,"25 дек, 12:33"
https://www.rbc.ru/rbcfreenews/61c6c4729a7947afa8d53776,СК задержал за взятку главу пожарной лаборатории в Подмосковье,"25 дек, 12:00"
https://www.rbc.ru/society/25/12/2021/61c6d2809a7947b24d122a08,Смертность от COVID в России оказалась ниже 1 тыс. второй день подряд,"25 дек, 11:13"
https://www.rbc.ru/rbcfreenews/61c6c5079a7947af47225115,Правительство выделит 1 млрд руб. на строительство больницы в Перми,"25 дек, 11:00"
https://www.rbc.ru/society/25/12/2021/61c6be989a7947aaece176ff,Европа встретила Рождество с рекордами по «омикрону»,"25 дек, 10:56"
https://www.rbc.ru/rbcfreenews/61c6b7719a7947a86bb66fb8,СК не получил доказательств соучастия сотрудников ИВС при побеге в Истре,"25 дек, 10:09"
https://www.rbc.ru/society/25/12/2021/61c67e6a9a7947a176a50e1b,В МЧС захотели создать реестр бывших сотрудников-коррупционеров,"25 дек, 05:30"
https://www.rbc.ru/rbcfreenews/61c6783c9a79479f4e5fe136,Экс-сотрудника Минобороны в Хабаровске приговорили к восьми годам тюрьмы,"25 дек, 05:07"
https://www.rbc.ru/rbcfreenews/61c61cdb9a79478c13088957,У патриарха Константинопольского Варфоломея обнаружили коронавирус,"24 дек, 22:46"
https://www.rbc.ru/society/24/12/2021/61c606999a794786f3a34feb,Суд взыскал с «Эха Москвы» ₽1 млн по иску Евгения Пригожина,"24 дек, 21:32"
https://www.rbc.ru/society/24/12/2021/61c5ec3f9a79477e824fe104,Первые партии подросткового «Спутника» получили разрешение на выпуск,"24 дек, 20:48"
https://www.rbc.ru/rbcfreenews/61c5f8af9a7947835da9a617,"Опрос показал, кого украинцы считают олигархами","24 дек, 20:43"
https://www.rbc.ru/rbcfreenews/61c5bbfb9a7947685bb11a96,Омбудсмен предложила индивидуальное обучение для 9-летней студентки МГУ,"24 дек, 20:33"
https://www.rbc.ru/society/24/12/2021/61c5f90f9a794782ec3933a4,Смоленского ректора заподозрили в создании фермы для майнинга в вузе,"24 дек, 20:22"
https://www.rbc.ru/rbcfreenews/61c5ccf39a7947725bbce2c2,СК Брянской области возбудил дело после отравления школьников,"24 дек, 18:48"
https://www.rbc.ru/rbcfreenews/61c5e2769a79477a6b44e457,Росавиация объяснила снижение летевшего из Саратова в Москву самолета,"24 дек, 18:21"
https://www.rbc.ru/society/24/12/2021/61c5d7429a794776bb273164,В Москве снизился уровень коллективного иммунитета к COVID-19,"24 дек, 17:23"
https://www.rbc.ru/society/24/12/2021/61c5d46c9a794775bd8c60e4,Уровень коллективного иммунитета в России превысил 60%,"24 дек, 17:15"
https://www.rbc.ru/rbcfreenews/61c5b6449a7947654c9d318b,СК возбудил дело после двух смертей при пожаре в COVID-больнице Астрахани,"24 дек, 15:44"
https://www.rbc.ru/rbcfreenews/61c585649a79474b4aebfb82,Прокуратура отозвала вызов на допрос украинского журналиста Цимбалюка,"24 дек, 15:38"
https://www.rbc.ru/rbcfreenews/61c5b9ef9a7947670d0838fd,ТАСС сообщил о двух за день сигналах тревоги от летевших самолетов,"24 дек, 15:32"
https://www.rbc.ru/rbcfreenews/61c590289a7947513011a867,"Россияне рассказали, где будут отмечать Новый год","24 дек, 15:23"
https://www.rbc.ru/rbcfreenews/61c58ac39a79474dfa32ea6d,В Оренбургской области мужчина пытался взорвать семью бывшей жены,"24 дек, 14:46"
https://www.rbc.ru/society/24/12/2021/61c5a7249a79475de11e1285,Умер сыгравший в «Шерлоке Холмсе» народный артист России Владимир Татосов,"24 дек, 14:34"
https://www.rbc.ru/rbcfreenews/61c5ad629a79476080d7f1b9,Семь человек пострадали при столкновении автобуса и поезда на Алтае,"24 дек, 14:34"
https://www.rbc.ru/rbcfreenews/61c5a39f9a79475cd81dda43,Кремль исключил необходимость импульсов от Путина для работы оперштаба,"24 дек, 14:32"
https://www.rbc.ru/rbcfreenews/61c5ab349a794760002bfd13,В забор генконсульства России во Львове бросили «коктейль Молотова»,"24 дек, 14:22"
https://www.rbc.ru/rbcfreenews/61c58fff9a794750410257a3,Россияне назвали три главных слова года,"24 дек, 14:16"
https://www.rbc.ru/society/24/12/2021/61c5a3419a79475ccbb1fed8,Москвичу дали четыре года колонии за осквернение фотографии ветерана,"24 дек, 13:51"
https://www.rbc.ru/rbcfreenews/61c5992e9a7947588b45a8b9,В Кремле объяснили несдержанностью слова журналистки о просроченном ПЦР,"24 дек, 13:24"
https://www.rbc.ru/rbcfreenews/61c58b4c9a79474e1a1f57d3,Путин поздравил Алиева с юбилеем,"24 дек, 12:34"
https://www.rbc.ru/rbcfreenews/61c56bdd9a79473f843a08eb,Еще две женщины обвинили актера Криса Нота в сексуальных домогательствах,"24 дек, 12:18"
https://www.rbc.ru/rbcfreenews/61c583ee9a79474a3dcc0b38,Совет Федерации одобрил закон об отмене обязательного техосмотра,"24 дек, 12:05"
https://www.rbc.ru/society/24/12/2021/61c582a59a7947483bf776f7,Главу БПК задержали за поставки китайских станков под видом российских,"24 дек, 12:03"
https://www.rbc.ru/rbcfreenews/61c571ab9a794741a8ec8567,Синоптик предупредил о снегопаде и «барической пиле» в Москве,"24 дек, 11:47"
https://www.rbc.ru/society/24/12/2021/61c585d29a79474b43e19ce5,Впервые за два месяца от COVID за сутки умерли меньше 1 тыс. россиян,"24 дек, 11:37"
https://www.rbc.ru/society/24/12/2021/61c5836b9a79474a3beb7b33,"Сносит людей, елки, крыши: как выглядела метель в Норильске","24 дек, 11:27"
https://www.rbc.ru/rbcfreenews/61c56acb9a79473eb39237fe,В Бангладеш 39 человек погибли при пожаре на пароме,"24 дек, 11:14"
https://www.rbc.ru/society/24/12/2021/61c57e689a794747275a02cd,Фигуранты дела о взятках при стройке «Зимней вишни» получили до 18 лет,"24 дек, 11:01"
